{
  "id": "doc:academic_paper_1",
  "title": "Neural Network Architectures for Natural Language Processing",
  "authors": [
    {
      "name": "Dr. Sarah Chen",
      "affiliation": "University of California, AI Research Lab"
    },
    {
      "name": "Prof. Michael Rodriguez",
      "affiliation": "University of California, AI Research Lab"
    }
  ],
  "publishedDate": "2024-03-15",
  "documentType": "academic_paper",
  "keywords": ["neural networks", "NLP", "transformer architecture", "attention mechanisms", "deep learning"],
  "abstract": "This paper presents novel neural network architectures optimized for natural language processing tasks, focusing on improved attention mechanisms and computational efficiency.",
  "content": {
    "sections": [
      {
        "title": "Introduction",
        "content": "Natural language processing has undergone significant transformations with the advent of deep learning...",
        "level": 1
      },
      {
        "title": "Related Work",
        "content": "The transformer architecture, introduced by Vaswani et al. (2017)...",
        "level": 1
      },
      {
        "title": "Methodology",
        "content": "Our approach introduces a novel attention mechanism...",
        "level": 1
      },
      {
        "title": "Experiments",
        "content": "We evaluated our model on standard NLP benchmarks...",
        "level": 1
      },
      {
        "title": "Discussion",
        "content": "The results demonstrate that our architectural innovations...",
        "level": 1
      },
      {
        "title": "Conclusion",
        "content": "We present a novel neural architecture that advances the state-of-the-art...",
        "level": 1
      }
    ],
    "wordCount": 1847,
    "readingTime": "PT8M"
  },
  "zptMapping": {
    "zoomLevels": {
      "EntityLevel": [
        {
          "type": "person",
          "value": "Vaswani et al.",
          "relevanceScore": 0.9
        },
        {
          "type": "concept",
          "value": "transformer architecture",
          "relevanceScore": 0.95
        },
        {
          "type": "concept",
          "value": "attention mechanisms",
          "relevanceScore": 0.93
        },
        {
          "type": "organization",
          "value": "University of California",
          "relevanceScore": 0.7
        }
      ],
      "UnitLevel": [
        {
          "type": "abstract",
          "title": "Abstract",
          "summary": "Novel neural network architectures for NLP with improved attention mechanisms",
          "wordCount": 42,
          "relevanceScore": 1.0
        },
        {
          "type": "section",
          "title": "Methodology",
          "summary": "Introduction of hierarchical attention, sparse connectivity, and dynamic routing",
          "wordCount": 387,
          "relevanceScore": 0.95
        },
        {
          "type": "section",
          "title": "Experiments",
          "summary": "Evaluation on GLUE, SQuAD, and WMT benchmarks showing improved performance",
          "wordCount": 256,
          "relevanceScore": 0.88
        }
      ],
      "TextLevel": {
        "fullText": true,
        "summary": "Academic paper presenting novel neural network architectures for NLP with improved computational efficiency and performance across multiple benchmarks.",
        "keyPoints": [
          "Novel attention mechanism reduces complexity from O(nÂ²) to O(n log n)",
          "Hierarchical attention and sparse connectivity innovations",
          "Consistent improvements across GLUE, SQuAD, and WMT tasks",
          "Maintains performance while improving efficiency"
        ]
      },
      "CommunityLevel": {
        "cluster": "transformer_architectures",
        "relatedDocuments": ["doc:academic_paper_2"],
        "topicSummary": "Part of research on advanced neural architectures for natural language processing"
      },
      "CorpusLevel": {
        "corpusContribution": "Contributes novel architectural approaches to the NLP literature",
        "significance": 0.82
      }
    },
    "panDomains": {
      "topicDomains": [
        {
          "domain": "academic",
          "coverage": 1.0,
          "specificity": "specialized"
        },
        {
          "domain": "ai_technology",
          "coverage": 0.95,
          "specificity": "specialized"
        }
      ],
      "temporalDomains": [
        {
          "period": "2024",
          "relevance": 1.0
        },
        {
          "period": "modern_ai_era",
          "relevance": 0.9
        }
      ],
      "entityDomains": [
        {
          "entityType": "organization",
          "entities": ["University of California"]
        },
        {
          "entityType": "person",
          "entities": ["Dr. Sarah Chen", "Prof. Michael Rodriguez"]
        }
      ]
    },
    "tiltProjections": {
      "keywordProjection": {
        "primaryTerms": [
          {
            "term": "neural networks",
            "frequency": 15,
            "tfidf": 0.87
          },
          {
            "term": "attention mechanisms",
            "frequency": 12,
            "tfidf": 0.82
          },
          {
            "term": "transformer",
            "frequency": 8,
            "tfidf": 0.75
          }
        ],
        "effectiveness": 0.88
      },
      "embeddingProjection": {
        "vectorSpace": "research_papers_768d",
        "dimensions": 768,
        "similarityThreshold": 0.75,
        "effectiveness": 0.92
      },
      "graphProjection": {
        "citationNetwork": {
          "incomingCitations": 0,
          "outgoingCitations": 4,
          "citationClusters": ["transformer_papers", "nlp_architectures"]
        },
        "topicNetwork": {
          "centralNodes": ["transformer", "attention", "nlp"],
          "connectivity": 0.85
        },
        "effectiveness": 0.78
      },
      "temporalProjection": {
        "chronologicalOrder": 4,
        "timelineRelevance": 0.95,
        "effectiveness": 0.72
      }
    },
    "optimizationScores": {
      "overall": 0.87,
      "zoomRelevance": 0.91,
      "panCoverage": 0.83,
      "tiltEffectiveness": 0.86
    }
  },
  "relations": {
    "citations": [
      {
        "target": "Vaswani et al. 2017",
        "type": "cites",
        "strength": 0.9
      },
      {
        "target": "Devlin et al. 2018",
        "type": "cites",
        "strength": 0.8
      }
    ],
    "topicalSimilarity": [
      {
        "document": "doc:academic_paper_2",
        "similarity": 0.65
      }
    ]
  },
  "access": {
    "complexity": "expert",
    "audience": ["researchers", "practitioners"],
    "language": "en",
    "accessibility": {
      "hasAltText": false,
      "hasTranscripts": false,
      "screenReaderFriendly": true
    }
  }
}